{"bounds":{"max_model_calls":8,"max_steps":16},"environment":{"agentdojo_package":"0.1.35","annotation_profiles":"conservative,oracle","benchmark":"v1.2.2"},"id":"agentdojo-local-pilot-v2","inputs":{"local-artifact-manifest":"32aa5a9c4cf3f73a0f5c84f0fbbf798f37520ecaa811a591a879d3b4f932a85c","research/experiments/suites/agentdojo-annotation-exceptions-v1.json":"f90ac6009b0f7ede0d0020e4bde8063902e5db7501b682e0ce5a980ae6c30500","research/experiments/suites/agentdojo-tool-schemas-v1.json":"a7ff193bde03cf77b35b0555493f96f4d70243cc06aa767dfc1490e2471d70d0"},"model":{"allow_private_remote":false,"backend":"transformers","context_limit":4096,"device":"cuda","dtype":"nf4","endpoint":null,"max_output_tokens":256,"model_id":"Qwen/Qwen2.5-14B-Instruct","prompt_template_version":"agentdojo_turn_v1","revision":"cf98f3b3bbb457ad9e2bb7baf9a0125b6b88caa8","runtime_version":"torch-2.14.1+cu130_transformers-5.19.0_bitsandbytes-0.50.2","seed":0,"temperature":0.0,"tokenizer_id":"Qwen/Qwen2.5-14B-Instruct","tokenizer_revision":"cf98f3b3bbb457ad9e2bb7baf9a0125b6b88caa8","top_p":1.0,"weight_manifest_sha256":"32aa5a9c4cf3f73a0f5c84f0fbbf798f37520ecaa811a591a879d3b4f932a85c"},"output_directory":"research/output/runs/runpod-h100-14b-stratified/agentdojo-stratified-banking-v1","prompts":{"agent":"agentdojo_turn_v1"},"repetitions":1,"rerun_command":["conflux","benchmark","agentdojo","run","--config","research/output/runs/runpod-h100-14b-stratified/agentdojo-stratified-banking-v1/protocol.json","--model-config","research/output/runs/runpod-Qwen-Qwen2.5-14B-Instruct/transformers.json","--output","research/output/runs/runpod-h100-14b-stratified/agentdojo-stratified-banking-v1","--execute-local"],"schema_version":"2","seeds":[0],"source_commit":"a61548ab59aecf990e3df46cce7cc733823b6fe3","suite":{"case_ids":["benign","attacked"],"id":"banking:stratified-v1","injection_task_ids":["injection_task_0"],"task_ids":["user_task_0","user_task_1","user_task_12","user_task_13"],"version":"v1.2.2"},"track":"agentdojo"}
