{"bounds":{"max_depth":4,"max_states":64,"max_transitions":256},"environment":{"network":"disabled","optional_backends":"discover_only"},"id":"sled-coi-reduction-v1","inputs":{"research/experiments/suites/sled-coi-v1/safe-noise.json":"da56565e5cc0890b07355806cb8fb6dfbd63b9866dacd16f61e5d85bf69d3f26","research/experiments/suites/sled-coi-v1/unsafe-control.json":"a6360336f1009d2da5b50c9dfeab2787862fd6944f2eb5e1ebd65f76df313a26"},"model":null,"output_directory":"runs/sled-coi-reduction-v1","prompts":{},"repetitions":1,"rerun_command":["python","scripts/generate_coi_evidence.py","runs/sled-coi-reduction-v1","--source-commit","c99aa1f42f8fcdc9a00c13160be66291de9c20bd"],"schema_version":"2","seeds":[0],"source_commit":"c99aa1f42f8fcdc9a00c13160be66291de9c20bd","suite":{"id":"sled-coi","version":"1"},"track":"verification_reduction"}
