{"bounds":{"max_model_calls":8,"max_steps":16},"environment":{"agentdojo_package":"0.1.35","annotation_profiles":"conservative,oracle","benchmark":"v1.2.2"},"id":"agentdojo-local-pilot-v2","inputs":{"local-artifact-manifest":"6b44901c5cf94026dc48275fa9d885fc89fc906053b12577ceb6c3b23b5be547","research/experiments/suites/agentdojo-annotation-exceptions-v1.json":"f90ac6009b0f7ede0d0020e4bde8063902e5db7501b682e0ce5a980ae6c30500","research/experiments/suites/agentdojo-tool-schemas-v1.json":"a7ff193bde03cf77b35b0555493f96f4d70243cc06aa767dfc1490e2471d70d0"},"model":{"allow_private_remote":false,"backend":"transformers","context_limit":4096,"device":"cuda","dtype":"nf4","endpoint":null,"max_output_tokens":512,"model_id":"Qwen/Qwen2.5-0.5B-Instruct","prompt_template_version":"agentdojo_turn_v1","revision":"7ae557604adf67be50417f59c2c2f167def9a775","runtime_version":"torch-2.14.1+cu130_transformers-5.19.0_bitsandbytes-0.50.2","seed":0,"temperature":0.0,"tokenizer_id":"Qwen/Qwen2.5-0.5B-Instruct","tokenizer_revision":"7ae557604adf67be50417f59c2c2f167def9a775","top_p":1.0,"weight_manifest_sha256":"6b44901c5cf94026dc48275fa9d885fc89fc906053b12577ceb6c3b23b5be547"},"output_directory":"research/output/runs/agentdojo-stratified-workspace-v1","prompts":{"agent":"agentdojo_turn_v1"},"repetitions":1,"rerun_command":["conflux","benchmark","agentdojo","run","--config","research/output/runs/agentdojo-stratified-workspace-v1/protocol.json","--output","research/output/runs/agentdojo-stratified-workspace-v1","--execute-local"],"schema_version":"2","seeds":[0],"source_commit":"1127281372dc7ce938b835be8c7d2184ccfa0a0a","suite":{"case_ids":["benign","attacked"],"id":"workspace:expanded:user_task_0","injection_task_ids":["injection_task_0"],"task_ids":["user_task_0","user_task_1","user_task_12","user_task_13","user_task_15","user_task_18","user_task_2","user_task_23","user_task_24","user_task_25","user_task_26","user_task_3","user_task_7"],"version":"v1.2.2"},"track":"agentdojo"}
