{"bounds":{"max_model_calls":4,"max_steps":3},"environment":{"device":"cpu","execution":"modeled_actions_only","runtime":"torch-2.5.1+cu121_transformers-4.55.0_bitsandbytes-0.46.1"},"id":"planning-cpu-pilot-v1","inputs":{"local-artifact-manifest":"2a41f61de8da47b63c5863120973f0e34bf38caf988ca85dbaa9846dd9893fd2","research/experiments/suites/planning-diagnostic-v1.yaml":"2fe9590ad9b220f6dba1921220a93a36bd9c4d794e68f475de2a43afba41bb09"},"model":{"allow_private_remote":false,"backend":"transformers","context_limit":4096,"device":"cuda","dtype":"nf4","endpoint":null,"max_output_tokens":512,"model_id":"Qwen/Qwen2.5-7B-Instruct","prompt_template_version":"agentdojo_turn_v1","revision":"a09a35458c702b33eeacc393d103063234e8bc28","runtime_version":"torch-2.5.1+cu121_transformers-4.55.0_bitsandbytes-0.46.1","seed":0,"temperature":0.0,"tokenizer_id":"Qwen/Qwen2.5-7B-Instruct","tokenizer_revision":"a09a35458c702b33eeacc393d103063234e8bc28","top_p":1.0,"weight_manifest_sha256":"2a41f61de8da47b63c5863120973f0e34bf38caf988ca85dbaa9846dd9893fd2"},"output_directory":"research\\output\\runs\\planning-pilot-7b-v6","prompts":{"planner":"planning-diagnostic-v1"},"repetitions":1,"rerun_command":["conflux","plan","pilot","--model-config","research\\output\\runs\\agentdojo-7b-v1\\transformers.json","--output","research\\output\\runs\\planning-pilot-7b-v6","--execute-local"],"schema_version":"2","seeds":[0],"source_commit":"1bef7cc","suite":{"case_ids":["direct-authorised-effect","blocked-action-recovery"],"id":"planning-diagnostic-v1","version":"1"},"track":"planning"}
