{"bounds":{"max_model_calls":4,"max_steps":3},"environment":{"device":"cpu","execution":"modeled_actions_only","runtime":"torch-2.5.1-transformers-4.55.0"},"id":"planning-cpu-pilot-v1","inputs":{"local-artifact-manifest":"73d946b2cc6511a3431e9866d6144da22b526e32ca9bd3bed23dce5e2db2111e","research/experiments/suites/planning-diagnostic-v1.yaml":"2fe9590ad9b220f6dba1921220a93a36bd9c4d794e68f475de2a43afba41bb09"},"model":{"allow_private_remote":false,"backend":"transformers","context_limit":4096,"device":"cuda","dtype":"nf4","endpoint":null,"max_output_tokens":512,"model_id":"LiquidAI/LFM2.5-1.2B-Instruct","prompt_template_version":"agentdojo_turn_v1","revision":"0f604ada3f766f9f257460c4c9f0b5d6f69d431b","runtime_version":"torch-2.5.1-transformers-4.55.0","seed":0,"temperature":0.0,"tokenizer_id":"LiquidAI/LFM2.5-1.2B-Instruct","tokenizer_revision":"0f604ada3f766f9f257460c4c9f0b5d6f69d431b","top_p":1.0,"weight_manifest_sha256":"73d946b2cc6511a3431e9866d6144da22b526e32ca9bd3bed23dce5e2db2111e"},"output_directory":"research\\output\\runs\\planning-pilot-lfm2-1b2-v1","prompts":{"planner":"planning-diagnostic-v1"},"repetitions":1,"rerun_command":["conflux","plan","pilot","--model-config","research\\output\\runs\\lfm2-1b2-v1\\transformers.json","--output","research\\output\\runs\\planning-pilot-lfm2-1b2-v1","--execute-local"],"schema_version":"2","seeds":[0],"source_commit":"2600f42","suite":{"case_ids":["direct-authorised-effect","blocked-action-recovery"],"id":"planning-diagnostic-v1","version":"1"},"track":"planning"}
