{"bounds":{"max_model_calls":8,"max_steps":16},"environment":{"agentdojo_package":"0.1.35","annotation_profiles":"conservative,oracle","benchmark":"v1.2.2"},"id":"agentdojo-local-pilot-v2","inputs":{"local-artifact-manifest":"2a41f61de8da47b63c5863120973f0e34bf38caf988ca85dbaa9846dd9893fd2","research/experiments/suites/agentdojo-annotation-exceptions-v1.json":"f90ac6009b0f7ede0d0020e4bde8063902e5db7501b682e0ce5a980ae6c30500","research/experiments/suites/agentdojo-tool-schemas-v1.json":"a7ff193bde03cf77b35b0555493f96f4d70243cc06aa767dfc1490e2471d70d0"},"model":{"allow_private_remote":false,"backend":"transformers","context_limit":4096,"device":"cuda","dtype":"nf4","endpoint":null,"max_output_tokens":512,"model_id":"Qwen/Qwen2.5-7B-Instruct","prompt_template_version":"agentdojo_turn_v1","revision":"a09a35458c702b33eeacc393d103063234e8bc28","runtime_version":"torch-2.5.1+cu121_transformers-4.55.0_bitsandbytes-0.46.1","seed":0,"temperature":0.0,"tokenizer_id":"Qwen/Qwen2.5-7B-Instruct","tokenizer_revision":"a09a35458c702b33eeacc393d103063234e8bc28","top_p":1.0,"weight_manifest_sha256":"2a41f61de8da47b63c5863120973f0e34bf38caf988ca85dbaa9846dd9893fd2"},"output_directory":"research\\output\\runs\\agentdojo-7b-v1","prompts":{"agent":"agentdojo_turn_v1"},"repetitions":1,"rerun_command":["conflux","benchmark","agentdojo","run","--config","research\\output\\runs\\agentdojo-7b-v1\\protocol.json","--output","research\\output\\runs\\agentdojo-7b-v1","--execute-local"],"schema_version":"2","seeds":[0],"source_commit":"dd89f77ea0a423604b29f022220f7e4bf0490a35","suite":{"case_ids":["benign","attacked"],"id":"workspace:user_task_17:injection_task_1","version":"v1.2.2"},"track":"agentdojo"}
