{"bounds":{"max_model_calls":4,"max_steps":3},"environment":{"device":"cpu","execution":"modeled_actions_only","runtime":"torch-2.5.1-transformers-4.55.0"},"id":"planning-cpu-pilot-v1","inputs":{"local-artifact-manifest":"34681e0b19a1915fdb27077a695abfd49f1f10f4cdf5711863ac361751c30d66","research/experiments/suites/planning-diagnostic-v1.yaml":"2fe9590ad9b220f6dba1921220a93a36bd9c4d794e68f475de2a43afba41bb09"},"model":{"allow_private_remote":false,"backend":"transformers","context_limit":4096,"device":"cuda","dtype":"nf4","endpoint":null,"max_output_tokens":512,"model_id":"ibm-granite/granite-3.3-2b-instruct","prompt_template_version":"agentdojo_turn_v1","revision":"707f574c62054322f6b5b04b6d075f0a8f05e0f0","runtime_version":"torch-2.5.1-transformers-4.55.0","seed":0,"temperature":0.0,"tokenizer_id":"ibm-granite/granite-3.3-2b-instruct","tokenizer_revision":"707f574c62054322f6b5b04b6d075f0a8f05e0f0","top_p":1.0,"weight_manifest_sha256":"34681e0b19a1915fdb27077a695abfd49f1f10f4cdf5711863ac361751c30d66"},"output_directory":"research\\output\\runs\\planning-pilot-granite-2b-v3","prompts":{"planner":"planning-diagnostic-v1"},"repetitions":1,"rerun_command":["conflux","plan","pilot","--model-config","research\\output\\runs\\granite-2b-v1\\transformers.json","--output","research\\output\\runs\\planning-pilot-granite-2b-v3","--execute-local"],"schema_version":"2","seeds":[0],"source_commit":"1bef7cc","suite":{"case_ids":["direct-authorised-effect","blocked-action-recovery"],"id":"planning-diagnostic-v1","version":"1"},"track":"planning"}
