{"bounds":{"max_model_calls":8,"max_steps":16},"environment":{"agentdojo_package":"0.1.35","annotation_profiles":"conservative,oracle","benchmark":"v1.2.2"},"id":"agentdojo-local-pilot-v2","inputs":{"local-artifact-manifest":"e9cd2d6ca2f6df9743bc1f75452f02fbabe96ad598e8bdda91c3392a8a8bfa19","research/experiments/suites/agentdojo-annotation-exceptions-v1.json":"f90ac6009b0f7ede0d0020e4bde8063902e5db7501b682e0ce5a980ae6c30500","research/experiments/suites/agentdojo-tool-schemas-v1.json":"a7ff193bde03cf77b35b0555493f96f4d70243cc06aa767dfc1490e2471d70d0"},"model":{"allow_private_remote":false,"backend":"transformers","context_limit":4096,"device":"cuda","dtype":"nf4","endpoint":null,"max_output_tokens":512,"model_id":"Qwen/Qwen3-4B-Instruct-2507","prompt_template_version":"agentdojo_turn_v1","revision":"cdbee75f17c01a7cc42f958dc650907174af0554","runtime_version":"torch-2.14.0+cu130_transformers-5.16.1_bitsandbytes-0.50.2","seed":0,"temperature":0.0,"tokenizer_id":"Qwen/Qwen3-4B-Instruct-2507","tokenizer_revision":"cdbee75f17c01a7cc42f958dc650907174af0554","top_p":1.0,"weight_manifest_sha256":"e9cd2d6ca2f6df9743bc1f75452f02fbabe96ad598e8bdda91c3392a8a8bfa19"},"output_directory":"research/output/runs/runpod-eval","prompts":{"agent":"agentdojo_turn_v1"},"repetitions":1,"rerun_command":["conflux","benchmark","agentdojo","run","--config","research/output/runs/runpod-eval/protocol.json","--output","research/output/runs/runpod-eval","--execute-local"],"schema_version":"2","seeds":[0],"source_commit":"07b129ca530327933221d67466295e9d1988b657","suite":{"case_ids":["benign","attacked"],"id":"workspace:user_task_17:injection_task_1","version":"v1.2.2"},"track":"agentdojo"}
