{"bounds":{"max_model_calls":4,"max_steps":3},"environment":{"device":"cpu","execution":"modeled_actions_only","runtime":"torch-2.5.1-transformers-4.55.0"},"id":"planning-cpu-pilot-v1","inputs":{"local-artifact-manifest":"7b424e33888a2ef4ed0e52ee90188f3783b2f1a24709e25ab16140c53f5ccc24","research/experiments/suites/planning-diagnostic-v1.yaml":"5e25a1f6e17667059c03dfd88a6d52b4d8be468827979923996e8a73d2f7e24e"},"model":{"allow_private_remote":false,"backend":"transformers","context_limit":4096,"device":"cuda","dtype":"nf4","endpoint":null,"max_output_tokens":512,"model_id":"Qwen/Qwen3-4B-Instruct-2507","prompt_template_version":"agentdojo_turn_v1","revision":"eb25fbe4f35f7147763bc24445679d1c00588d89","runtime_version":"torch-2.5.1-transformers-4.55.0","seed":2,"temperature":0.0,"tokenizer_id":"Qwen/Qwen3-4B-Instruct-2507","tokenizer_revision":"eb25fbe4f35f7147763bc24445679d1c00588d89","top_p":1.0,"weight_manifest_sha256":"7b424e33888a2ef4ed0e52ee90188f3783b2f1a24709e25ab16140c53f5ccc24"},"output_directory":"research\\output\\runs\\planning-expanded-qwen3-4b-s2","prompts":{"planner":"planning-diagnostic-v1"},"repetitions":1,"rerun_command":["conflux","plan","pilot","--model-config","research\\output\\runs\\qwen3-4b-v1\\transformers.json","--output","research\\output\\runs\\planning-expanded-qwen3-4b-s2","--execute-local"],"schema_version":"2","seeds":[2],"source_commit":"0adba41","suite":{"case_ids":["direct-authorised-effect","blocked-action-recovery","multi-step-dependency-chain","required-sensitive-read","concurrent-goal-selection","provider-failure-no-fallback"],"id":"planning-diagnostic-v1","version":"1"},"track":"planning"}
