{"bounds":{"max_model_calls":4,"max_steps":3},"environment":{"device":"cpu","execution":"modeled_actions_only","runtime":"torch-2.5.1-transformers-4.55.0"},"id":"planning-cpu-pilot-v1","inputs":{"local-artifact-manifest":"0de463f9ef8780180817a5ddf81aef1c953c8203165997453655b96509b8786b","research/experiments/suites/planning-diagnostic-v1.yaml":"2fe9590ad9b220f6dba1921220a93a36bd9c4d794e68f475de2a43afba41bb09"},"model":{"allow_private_remote":false,"backend":"transformers","context_limit":4096,"device":"cuda","dtype":"nf4","endpoint":null,"max_output_tokens":512,"model_id":"Qwen/Qwen2.5-0.5B-Instruct","prompt_template_version":"agentdojo_turn_v1","revision":"7ae557604adf67be50417f59c2c2f167def9a775","runtime_version":"torch-2.5.1-transformers-4.55.0","seed":0,"temperature":0.0,"tokenizer_id":"Qwen/Qwen2.5-0.5B-Instruct","tokenizer_revision":"7ae557604adf67be50417f59c2c2f167def9a775","top_p":1.0,"weight_manifest_sha256":"0de463f9ef8780180817a5ddf81aef1c953c8203165997453655b96509b8786b"},"output_directory":"research\\output\\runs\\planning-pilot-0b5-v2","prompts":{"planner":"planning-diagnostic-v1"},"repetitions":1,"rerun_command":["conflux","plan","pilot","--model-config","research\\output\\runs\\qwen-0b5-v1\\transformers.json","--output","research\\output\\runs\\planning-pilot-0b5-v2","--execute-local"],"schema_version":"2","seeds":[0],"source_commit":"2600f42","suite":{"case_ids":["direct-authorised-effect","blocked-action-recovery"],"id":"planning-diagnostic-v1","version":"1"},"track":"planning"}
