{"bounds":{"max_model_calls":4,"max_steps":3},"environment":{"device":"cpu","execution":"modeled_actions_only","runtime":"torch-2.5.1+cu121_transformers-4.55.0_bitsandbytes-0.46.1"},"id":"planning-cpu-pilot-v1","inputs":{"experiments/suites/planning-diagnostic-v1.yaml":"2fe9590ad9b220f6dba1921220a93a36bd9c4d794e68f475de2a43afba41bb09","local-artifact-manifest":"03c58eae80106335949e0e0e947cdbcf3309f7d27a9ba4ce05e53701fbf760f0"},"model":{"allow_private_remote":false,"backend":"transformers","context_limit":4096,"device":"cuda","dtype":"nf4","endpoint":null,"max_output_tokens":256,"model_id":"Qwen/Qwen2.5-1.5B-Instruct","prompt_template_version":"agentdojo_turn_v1","revision":"989aa7980e4cf806f80c7fef2b1adb7bc71aa306","runtime_version":"torch-2.5.1+cu121_transformers-4.55.0_bitsandbytes-0.46.1","seed":0,"temperature":0.0,"tokenizer_id":"Qwen/Qwen2.5-1.5B-Instruct","tokenizer_revision":"989aa7980e4cf806f80c7fef2b1adb7bc71aa306","top_p":1.0,"weight_manifest_sha256":"03c58eae80106335949e0e0e947cdbcf3309f7d27a9ba4ce05e53701fbf760f0"},"output_directory":"output\\runs\\planning-pilot-1b5-v1","prompts":{"planner":"planning-diagnostic-v1"},"repetitions":1,"rerun_command":["conflux","plan","pilot","--model-config","output\\runs\\agentdojo-1b5-nf4-v1\\transformers.json","--output","output\\runs\\planning-pilot-1b5-v1","--execute-local"],"schema_version":"2","seeds":[0],"source_commit":"d163c1e8f61765bd9f4dcb8fde043b609d175beb","suite":{"case_ids":["direct-authorised-effect","blocked-action-recovery"],"id":"planning-diagnostic-v1","version":"1"},"track":"planning"}
