{"bounds":{"max_model_calls":8,"max_steps":16},"environment":{"agentdojo_package":"0.1.35","annotation_profiles":"conservative,oracle","benchmark":"v1.2.2"},"id":"agentdojo-local-pilot-v2","inputs":{"local-artifact-manifest":"a85002c8678eabce76ebdc597a114a083465a2d964db95981b6fd9212067b0de","research/experiments/suites/agentdojo-annotation-exceptions-v1.json":"f90ac6009b0f7ede0d0020e4bde8063902e5db7501b682e0ce5a980ae6c30500","research/experiments/suites/agentdojo-tool-schemas-v1.json":"a7ff193bde03cf77b35b0555493f96f4d70243cc06aa767dfc1490e2471d70d0"},"model":{"allow_private_remote":false,"backend":"transformers","context_limit":4096,"device":"cuda","dtype":"nf4","endpoint":null,"max_output_tokens":512,"model_id":"Qwen/Qwen2.5-3B-Instruct","prompt_template_version":"agentdojo_turn_v1","revision":"aa8e72537993ba99e69dfaafa59ed015b17504d1","runtime_version":"torch-2.5.1+cu121_transformers-4.55.0_bitsandbytes-0.46.1","seed":0,"temperature":0.0,"tokenizer_id":"Qwen/Qwen2.5-3B-Instruct","tokenizer_revision":"aa8e72537993ba99e69dfaafa59ed015b17504d1","top_p":1.0,"weight_manifest_sha256":"a85002c8678eabce76ebdc597a114a083465a2d964db95981b6fd9212067b0de"},"output_directory":"research\\output\\runs\\agentdojo-3b-v4","prompts":{"agent":"agentdojo_turn_v1"},"repetitions":1,"rerun_command":["conflux","benchmark","agentdojo","run","--config","research\\output\\runs\\agentdojo-3b-v4\\protocol.json","--output","research\\output\\runs\\agentdojo-3b-v4","--execute-local"],"schema_version":"2","seeds":[0],"source_commit":"2a543cc","suite":{"case_ids":["benign","attacked"],"id":"workspace:expanded:user_task_14","task_ids":["user_task_14","user_task_16","user_task_17","user_task_22","user_task_39"],"version":"v1.2.2"},"track":"agentdojo"}
